comments,subreddit,thumb_url,timestamp,title,url,votes
0,NO SUBREDDIT,NO THUMBNAIL,NO TIMESTAMP,NO TITLE,NO URL,NO INFO
363,/r/Art,//b.thumbs.redditmedia.com/p32PnbLD9t9hqvw9Q5X7eZS2tI7Ygqnh5K5MTxOERSE.jpg,2016-06-22T17:27:43+00:00,"""Two clowns in the same circus"" 16 x 12s oil on linen",https://www.reddit.com//r/Art/comments/4pbvk5/two_clowns_in_the_same_circus_16_x_12s_oil_on/,4195
1464,/r/worldnews,NO THUMBNAIL,2016-06-22T13:34:40+00:00,German government agrees to ban fracking indefinitely,http://www.reuters.com/article/us-germany-fracking-idUSKCN0Z71YY,6305
475,/r/gaming,//b.thumbs.redditmedia.com/8AxUx614o-9HwX6h0TT8d2gKNht3WfAKjAMgxgcnkbs.jpg,2016-06-22T14:43:19+00:00,This fucking guy.,http://i.imgur.com/kMU650X.png,4997
2395,/r/gifs,//a.thumbs.redditmedia.com/Wy6NaJmkRLZ2DbJbFoeo86ktB42wHwIMYwij4tObA18.jpg,2016-06-22T12:17:41+00:00,Irish fans fixing a dent in somebody's car,http://i.imgur.com/Ad1ToEa.gifv,7509
2793,/r/nottheonion,//b.thumbs.redditmedia.com/eM_f1SKssiVX7FQRYP803V5KTTR-5t3OSgt6JbkpEkI.jpg,2016-06-22T13:23:53+00:00,"For men, the importance of safe sex depends on how hot their partner is",http://arstechnica.com/science/2016/06/for-men-the-importance-of-safe-sex-depends-on-how-hot-their-partner-is/,5208
350,/r/photoshopbattles,//b.thumbs.redditmedia.com/scESvIJJHeAPC5MxSIS4rJRciOmxa9APzUygVQbxCOQ.jpg,2016-06-22T13:00:45+00:00,PsBattle: Peter Dinklage riding a scooter,http://i.imgur.com/vrMkgxQ.jpg,5294
383,/r/videos,//a.thumbs.redditmedia.com/IB3RJvoceakX-UmThcddJHWTiBWBMdm434M28_qFty4.jpg,2016-06-22T15:34:53+00:00,"Ireland fans dent the roof of a French car, fix it straight away",https://youtu.be/KHPcg8MeWUQ,3223
642,/r/funny,//b.thumbs.redditmedia.com/JyqfanLHxAJf3fAapXOhSupHU3JcOVwo8AOhWYRMv3c.jpg,2016-06-22T12:12:57+00:00,Ill bet this was a drunk idea gone right.,https://imgur.com/gallery/gJgxe,5991
386,/r/LifeProTips,NO THUMBNAIL,2016-06-22T14:34:12+00:00,LPT: Make a distinct bend in your business card before dropping it in a bowl used for a drawing. The drawer is more likely to pick a card that sticks out rather than lays flat.,https://www.reddit.com//r/LifeProTips/comments/4pay8c/lpt_make_a_distinct_bend_in_your_business_card/,3704
536,/r/OldSchoolCool,//b.thumbs.redditmedia.com/9Y1U2tPNXrBUGMUcRdPIwoIPWYlqJjGwdSeQ_l-whFc.jpg,2016-06-22T12:26:23+00:00,"Albert Einstein and Charlie Chaplain, 1931",http://i.imgur.com/100VGtu.jpg,5439
2371,/r/pics,//b.thumbs.redditmedia.com/2bbppj9BDN3di1hu1AVNOFnDrMjmf95Y_eRRwmTltac.jpg,2016-06-22T12:33:58+00:00,Married With Children cast all grown up,http://i.imgur.com/SZT8awC.jpg,5402
757,/r/aww,//b.thumbs.redditmedia.com/fTR__mWxn5ePLV5RICRZJNR9quFyh9gIfKuyrTIatos.jpg,2016-06-22T11:56:03+00:00,This grumpy asshole is nearly 18 and still refusing to kick the bucket.,http://imgur.com/q95L7c7,5699
1072,/r/IAmA,NO THUMBNAIL,2016-06-22T13:55:21+00:00,I created a startup that helps people pay off their student loans. AMA!,https://www.reddit.com//r/IAmA/comments/4parc7/i_created_a_startup_that_helps_people_pay_off/,3799
388,/r/personalfinance,NO THUMBNAIL,2016-06-22T16:17:27+00:00,My mom just left and I'm going to be homeless at the end of the month. I'm really scared and don't know what to do.,https://www.reddit.com//r/personalfinance/comments/4pbhl1/my_mom_just_left_and_im_going_to_be_homeless_at/,2405
402,/r/food,//a.thumbs.redditmedia.com/UY9ZK1KooDfylA1ME0I8DVJLbObTI0pmpmPDtYvhDq4.jpg,2016-06-22T14:33:27+00:00,Twent to Japan and finally had one of the first things i ever saw on Reddit!,http://i.imgur.com/x0HJXXJ.jpg,3234
7468,/r/AskReddit,NO THUMBNAIL,2016-06-22T12:05:01+00:00,What are the telltale signs that you're heading for a breakup?,https://www.reddit.com//r/AskReddit/comments/4paaii/what_are_the_telltale_signs_that_youre_heading/,4735
268,/r/creepy,//b.thumbs.redditmedia.com/tJNiRLpaITcbVdgnl_1vau__9XFXAOvfyOJg-PhPLQQ.jpg,2016-06-22T12:19:33+00:00,The Chainman,https://cdn2.artstation.com/p/assets/images/images/000/147/342/large/yo-shimizu-egao.jpg?1406551607,3354
825,/r/movies,//b.thumbs.redditmedia.com/nTN4VKADc9VxGaMVco4kB_O-I8OleAhsLDNYpLng9lo.jpg,2016-06-22T10:10:44+00:00,11 Early drafts of memorable movie quotes [OC],http://imgur.com/a/sc9e0,4931
3066,/r/news,NO THUMBNAIL,2016-06-22T11:32:26+00:00,"The Marine Corps’ new training regime, meant to emphasize gender-neutral standards for combat jobs, has weeded out 40 male recruits and all but one female recruit since the standards were put in place at the beginning of the year, according to documents obtained by The Washington Post.",https://www.washingtonpost.com/news/checkpoint/wp/2016/06/22/how-the-marines-new-physical-standards-for-combat-jobs-weed-out-men-and-women/?tid=sm_tw,3796
211,/r/EarthPorn,//b.thumbs.redditmedia.com/ONl8h5oLwOSkmDCE_ATS3z2oxVYlWlmO2NYn1BJ6V5M.jpg,2016-06-22T08:27:14+00:00,"Mount Rainier, Washington at sunrise in autumn [1200x866][OC] by Alex Noriega",http://www.alexnoriegaphotography.com/Portfolio/Mountains/i-8RLf55r/8/O/volcanic-autumn1200.jpg,4842
943,/r/dataisbeautiful,//a.thumbs.redditmedia.com/4jatMln2PONqy-3Xu15BT-0COi0WUX3SB2jCgilNav8.jpg,2016-06-22T12:43:54+00:00,TV shows that got better over time and TV shows that remained most consistent [OC],http://imgur.com/a/JRGUh,2121
83,/r/mildlyinteresting,//b.thumbs.redditmedia.com/bSBXmnrZzNptdWFjcAA5-gnNpxwO3i27KdXTx9V6wOY.jpg,2016-06-22T13:30:04+00:00,Triggerfish got itself caught in my friend's knee brace while he was surfing yesterday.,http://imgur.com/qgsn1Ne,1677
97,/r/science,NO THUMBNAIL,2016-06-22T12:00:20+00:00,"PLOS Science Wednesday: Hi Reddit, I'm Professor Damien Keating and I discovered gene RCAN1 is linked to blood sugar problems in both Type 2 Diabetes and Down Syndrome -- Ask Me Anything!",https://www.reddit.com//r/science/comments/4pa9x2/plos_science_wednesday_hi_reddit_im_professor/,1980
76,/r/GetMotivated,//b.thumbs.redditmedia.com/zDa-cnZxiORI6eFneQM3Noj8YleeIs7q8Hq7i6qxtxw.jpg,2016-06-22T12:54:53+00:00,[Image] Made this wallpaper to motivate me. Thought it might help others :) [2880x1800],http://imgur.com/KPS2xXE,1587
